url,change,changeDescription,multipleCompulsory,department,id,grade,class,name,credit,yearSemester,compulsory,restrict,select,selected,remaining,teacher,room,classTime,description,tags,english
https://selcrs.nsysu.edu.tw/menu5/showoutline.asp?SYEAR=114&SEM=1&CrsDat=ICM549&Crsname=資訊素養與倫理,異動,更換時間8/4,False,行銷傳播碩,ICM549,0,不分班,"資訊素養與倫理
INFORMATION LITERACY AND ETHICS",3,期,False,50,4,39,11,鄭安授,"四C,D,E(管CM 2037)","['', '', '', 'CDE', '', '', '']",《講授類》,['資通安全學程'],False
https://selcrs.nsysu.edu.tw/menu5/showoutline.asp?SYEAR=114&SEM=1&CrsDat=ICM557&Crsname=行銷傳播管理研究方法,,,False,行銷傳播碩,ICM557,0,不分班,"行銷傳播管理研究方法
MARKETING COMMUNICATION RESEARCH METHODS",3,期,False,50,0,19,31,周軒逸,"四2,3,4(管CM 2032)","['', '', '', '234', '', '', '']",《講授類》,[],False
https://selcrs.nsysu.edu.tw/menu5/showoutline.asp?SYEAR=114&SEM=1&CrsDat=ICM557A&Crsname=行銷傳播管理講座（一）,,,False,行銷傳播碩,ICM557A,0,不分班,"行銷傳播管理講座（一）
SEMINAR ON MARKETING COMMUNICATIONS (I)",1,期,False,50,3,45,5,王紹蓉,五C(管CM 2037),"['', '', '', '', 'C', '', '']",《講授類》,[],False
https://selcrs.nsysu.edu.tw/menu5/showoutline.asp?SYEAR=114&SEM=1&CrsDat=ICM559&Crsname=數位內容與社會網絡分析,,,False,行銷傳播碩,ICM559,0,不分班,"數位內容與社會網絡分析
DIGITAL CONTENT  ANALYSIS AND SOCIAL NETWOK ANALYSIS",3,期,False,50,0,10,40,譚躍,"五8,6,7(管CM 2023)","['', '', '', '', '678', '', '']",《講授類》,['政經大數據分析微學程'],False
https://selcrs.nsysu.edu.tw/menu5/showoutline.asp?SYEAR=114&SEM=1&CrsDat=ICM561&Crsname=企業傳播與實務,,,False,行銷傳播碩,ICM561,0,不分班,"企業傳播與實務
CORPORATE COMMUNICATION AND PRACTICE",1,期,False,50,1,14,36,王紹蓉,五2(管CM 2032),"['', '', '', '', '2', '', '']","《講授類》
限行傳所碩士班學生選修；英語授課",[],False
https://selcrs.nsysu.edu.tw/menu5/showoutline.asp?SYEAR=114&SEM=1&CrsDat=ICM641&Crsname=閱聽人態度理論專題研究,,,False,行銷傳播碩,ICM641,0,不分班,"閱聽人態度理論專題研究
INDEPENDENT STUDIES IN AUDIENCE ATTITUDE THEORIES",3,期,False,50,1,1,49,周軒逸,"二8,6,7(管CM 2032)","['', '678', '', '', '', '', '']","《獨立研究》
限行傳所碩士班二年級學生選修",[],False
https://selcrs.nsysu.edu.tw/menu5/showoutline.asp?SYEAR=114&SEM=1&CrsDat=ICM644&Crsname=數位時代的隱私與監控專題研究,,,False,行銷傳播碩,ICM644,0,不分班,"數位時代的隱私與監控專題研究
INDEPENDENT STUDIES IN PRIVACY AND SURVEILLANCE",3,期,False,50,0,5,45,王紹蓉,"四2,3,4(管CM 2029)","['', '', '', '234', '', '', '']","《獨立研究》
限行傳所碩士班二年級學生選修",[],False
https://selcrs.nsysu.edu.tw/menu5/showoutline.asp?SYEAR=114&SEM=1&CrsDat=ICM649&Crsname=社會行銷專題研究,異動,更換時間8/29,False,行銷傳播碩,ICM649,0,不分班,"社會行銷專題研究
INDEPENDENT STUDIES IN SOCIAL MARKETING",3,期,False,50,0,1,49,譚躍,"一2,3,4(管CM 2029)","['234', '', '', '', '', '', '']","《獨立研究》
限行傳所碩士班二年級學生選修",[],False
https://selcrs.nsysu.edu.tw/menu5/showoutline.asp?SYEAR=114&SEM=1&CrsDat=ICM652&Crsname=社會科學量化分析,,,False,行銷傳播碩,ICM652,0,不分班,"社會科學量化分析
DATA ANALYSIS OF SOCIAL SCIENCE",3,期,False,50,2,9,41,張榮華,"二C,D,E(管CM 2032)","['', 'CDE', '', '', '', '', '']","《講授類》
限行傳所修畢量化研究方法課程學生選修",[],False
https://selcrs.nsysu.edu.tw/menu5/showoutline.asp?SYEAR=114&SEM=1&CrsDat=ICM653&Crsname=專題研究（一）,,,False,行銷傳播碩,ICM653,0,不分班,"專題研究（一）
INDEPENDENT STUDIES(I)",3,期,False,50,0,4,46,鄭安授,"一2,3,4(管CM 2032)","['234', '', '', '', '', '', '']","《獨立研究》
限行傳所碩士班二年級學生選修",[],False
https://selcrs.nsysu.edu.tw/menu5/showoutline.asp?SYEAR=114&SEM=1&CrsDat=ICM658&Crsname=永續行銷專題研究,,,False,行銷傳播碩,ICM658,0,不分班,"永續行銷專題研究
INDEPENDENT STUDIES IN SUSTAINABLE MARKETING",3,期,False,50,0,1,49,李雅靖,"三5,6,7(管CM 2029)","['', '', '567', '', '', '', '']","《獨立研究》
限行傳所碩士班二年級學生選修",[],False
https://selcrs.nsysu.edu.tw/menu5/showoutline.asp?SYEAR=114&SEM=1&CrsDat=ICM660&Crsname=網路口碑專題研究,異動,更換時間及教室8/18,False,行銷傳播碩,ICM660,0,不分班,"網路口碑專題研究
INDEPENDENT STUDIES IN ELECTRONIC WORD-OF-MOUTH",3,期,False,50,0,3,47,張榮華,"二8,6,7(管CM 2029)","['', '678', '', '', '', '', '']","《獨立研究》
限行傳所碩士班二年級學生選修",[],False
https://selcrs.nsysu.edu.tw/menu5/showoutline.asp?SYEAR=114&SEM=1&CrsDat=CM503&Crsname=大數據分析、機器學習、與人工智慧方法,,,False,管理學院(碩),CM503,0,不分班,"大數據分析、機器學習、與人工智慧方法
BIG DATA ANALYTICS, MACHINE LEARNING, AND ARTIFICIAL INTELLIGENCE",3,期,False,50,4,21,29,康藝晃,"三5,6,7(管CM 3051)","['', '', '567', '', '', '', '']","《講授類》
本課程與MIS572併班上課/本課程為商業大數據系列課程之一","['永續能源學程', '計算物理及人工智慧微學程', '機器學習與多媒體技術學程', '跨領域智慧製造學程', '商業數據分析與創新微學程', '金融數據分析與創新微學程', '製造與大數據分析微學程', '機器學習與應用微學程']",False
https://selcrs.nsysu.edu.tw/menu5/showoutline.asp?SYEAR=114&SEM=1&CrsDat=CM507&Crsname=倫理與社會責任,,,False,管理學院(碩),CM507,0,不分班,"倫理與社會責任
ETHICS AND SOCIAL RESPONSIBILITY",1,期,False,200,54,169,31,"王致遠,謝慧賢,鄭安授,陳世哲",一A(網路大學),"['A', '', '', '', '', '', '']","《講授類》
『本課程之限修，於加退選2階段開放選修』。網大進行之非同步線上課程(二年級優先選課) 限管理學院研究所學生修習。 CM507與CM511為同系列課程，學生只能夠就此課程當中選擇一門課進行修習，已經修習過上述任何一個課程者均不得選課。","['公共事務與企業社會責任微學程', '人力資源管理學程', '企業社會責任學程']",False
https://selcrs.nsysu.edu.tw/menu5/showoutline.asp?SYEAR=114&SEM=1&CrsDat=CM508&Crsname=職涯準備,,,False,管理學院(碩),CM508,0,不分班,"職涯準備
CAREER PREPAREDNESS",1,期,False,50,2,14,36,張姮燕,四5(管CM 1019),"['', '', '', '5', '', '', '']",《講授類》,['人力資源管理學程'],False
https://selcrs.nsysu.edu.tw/menu5/showoutline.asp?SYEAR=114&SEM=1&CrsDat=CM511&Crsname=國際商管倫理觀,,,False,管理學院(碩),CM511,0,不分班,"國際商管倫理觀
ETHICS IN INTERNATIONAL BUSINESS MANAGEMENT",1,期,False,60,3,7,53,"王致遠,王豫萱,鄭安授",二A(網路大學),"['', 'A', '', '', '', '', '']","《講授類》
『本課程之限修，於加退選2階段開放選修』。網大進行之非同步線上課程(二年級優先選課) 限管理學院研究所學生修習。 CM507與CM511為同系列課程，學生只能夠就此課程當中選擇一門課進行修習，已經修習過上述任何一個課程者均不得選課。",[],True
https://selcrs.nsysu.edu.tw/menu5/showoutline.asp?SYEAR=114&SEM=1&CrsDat=CM512&Crsname=商業分析實務,,,False,管理學院(碩),CM512,0,不分班,"商業分析實務
PRACTICAL BUSINESS ANALYSIS",3,期,False,70,10,31,39,卓雍然,"五2,3,4(管CM 3051)","['', '', '', '', '234', '', '']","《講授類》
本課程為商業大數據系列課程之一","['科技創新與服務業管理學程', '人工智能投資微學程', '商業數據分析與創新微學程']",False
https://selcrs.nsysu.edu.tw/menu5/showoutline.asp?SYEAR=114&SEM=1&CrsDat=CM513&Crsname=商管軟體設計,,,False,管理學院(碩),CM513,0,不分班,"商管軟體設計
BUSINESS MANAGEMENT SOFTWARE DESIGN",3,期,False,50,3,15,35,"宋世祥,韓毅,黃三益","三5,6,7(管CM 3038)","['', '', '567', '', '', '', '']","《講授類》
本課程為商業大數據系列課程之一","['商業數據分析與創新微學程', '金融數據分析與創新微學程']",False
https://selcrs.nsysu.edu.tw/menu5/showoutline.asp?SYEAR=114&SEM=1&CrsDat=CM514&Crsname=金融數據分析,,,False,管理學院(碩),CM514,0,不分班,"金融數據分析
FINANCIAL DATA ANALYSIS",3,期,False,16,8,16,0,王昭文,"四5,6,7(管CM 3051)","['', '', '', '567', '', '', '']","《講授類》
本課程與FM617併班上課。本課程為商業大數據系列課程之一",['金融數據分析與創新微學程'],False
https://selcrs.nsysu.edu.tw/menu5/showoutline.asp?SYEAR=114&SEM=1&CrsDat=CM515&Crsname=永續金融,,,False,管理學院(碩),CM515,0,不分班,"永續金融
SUSTAINABLE FINANCE",2,期,False,50,8,17,33,"林新沛,王昭文","三3,4(管CM 4069)","['', '', '34', '', '', '', '']","《講授類》
永續管理微學程課程之一","['地方創生與永續發展整合學程', '淨零轉型與永續發展整合學程', '企業社會責任學程', '永續管理微學程']",False
