url,change,changeDescription,multipleCompulsory,department,id,grade,class,name,credit,yearSemester,compulsory,restrict,select,selected,remaining,teacher,room,classTime,description,tags,english
https://selcrs.nsysu.edu.tw/menu5/showoutline.asp?SYEAR=114&SEM=1&CrsDat=GEAI1966&Crsname=改變世界的分子：藥物的藝術與社會影響力,,,False,跨院選修(醫),GEAI1966,0,不分班,"改變世界的分子：藥物的藝術與社會影響力
THE MOLECULES THAT CHANGED THE WORLD: THE ART AND SOCIAL IMPACT OF MEDICINES",2,期,False,30,5,30,0,陳亮傑,"一6,7(醫IL 9012)","['67', '', '', '', '', '', '']","《講授類》
跨院通識與醫學院MED155課程併班上課",[],False
https://selcrs.nsysu.edu.tw/menu5/showoutline.asp?SYEAR=114&SEM=1&CrsDat=GEAI1967&Crsname=深睡的力量：揭開睡眠與健康的面紗,,,False,跨院選修(醫),GEAI1967,0,不分班,"深睡的力量：揭開睡眠與健康的面紗
THE DEEP POWER OF SLEEP: UNDERSTANDING SLEEP AND HEALTH",3,期,False,25,13,25,0,陳嬿今,"四5,6,7(醫IL 3013)","['', '', '', '567', '', '', '']","《講授類》
跨院通識與醫學院MED156課程併班上課",[],False
https://selcrs.nsysu.edu.tw/menu5/showoutline.asp?SYEAR=114&SEM=1&CrsDat=GEAI1968&Crsname=生活柯南：破解似是而非的迷思,異動,確認教師8/18,False,跨院選修(醫),GEAI1968,0,不分班,"生活柯南：破解似是而非的迷思
LIVING CONAN: CRACKING THE MYTHS OF PLAUSIBILITY",2,期,False,30,2,29,1,"葉俊吟,陳嬿今","四2,3(醫IL 3013)","['', '', '', '23', '', '', '']","《講授類》
跨院通識與醫學院MED157課程併班上課",[],False
https://selcrs.nsysu.edu.tw/menu5/showoutline.asp?SYEAR=114&SEM=1&CrsDat=GEAI1969&Crsname=與老共舞,異動,確認教師8/18,False,跨院選修(醫),GEAI1969,0,不分班,"與老共舞
LIVING WITH AGING: GERIATRIC CARE FOR OLDER ADULTS",3,期,False,25,2,21,4,"葉俊吟,陳嬿今","三5,6,7(醫IL 3013)","['', '', '567', '', '', '', '']","《講授類》
跨院通識與醫學院MED158課程併班上課","['表達性藝術治療學程', '音樂應用與高齡友善多元性微學程', '音樂與高齡照護學程']",True
https://selcrs.nsysu.edu.tw/menu5/showoutline.asp?SYEAR=114&SEM=1&CrsDat=GEAI1970&Crsname=看不見的魔力：生活中的微生物之應用,,,False,跨院選修(醫),GEAI1970,0,不分班,"看不見的魔力：生活中的微生物之應用
THE INVISIBLE MAGIC: MICROORGANISMS AND THEIR APPLICATIONS IN DAILY LIFE",2,期,False,25,2,11,14,陳彥樺,"三5,6(醫IL 9014)","['', '', '56', '', '', '', '']","《講授類》
跨院通識與醫學院MED159課程併班上課",[],True
https://selcrs.nsysu.edu.tw/menu5/showoutline.asp?SYEAR=114&SEM=1&CrsDat=GEAI1971&Crsname=智慧醫療：台灣醫療體系導覽,,,False,跨院選修(醫),GEAI1971,0,不分班,"智慧醫療：台灣醫療體系導覽
SMART HEALTHCARE: A GUIDE TO TAIWAN’S HEALTHCARE SYSTEM",2,期,False,30,12,30,0,張博智,"四3,4(醫IL 9010)","['', '', '', '34', '', '', '']","《講授類》
跨院通識與醫學院MED164課程併班上課",[],False
https://selcrs.nsysu.edu.tw/menu5/showoutline.asp?SYEAR=114&SEM=1&CrsDat=GEAI1975&Crsname=令人驚奇的0-6歲幼兒成長旅程,,,False,跨院選修(醫),GEAI1975,0,不分班,"令人驚奇的0-6歲幼兒成長旅程
THE AMAZING JOURNEY OF GROWTH IN CHILDREN AGED 0-6 YEARS",2,期,False,40,2,7,33,陳秀玲,"四8,7(醫IL 9012)","['', '', '', '78', '', '', '']","《講授類》
跨院通識與醫學院MED162課程併班上課",[],False
https://selcrs.nsysu.edu.tw/menu5/showoutline.asp?SYEAR=114&SEM=1&CrsDat=GEAI1976&Crsname=新生兒急救：從零開始掌握關鍵技能,,,False,跨院選修(醫),GEAI1976,0,不分班,"新生兒急救：從零開始掌握關鍵技能
NEONATAL RESUSCITATION: MASTERING ESSENTIAL SKILLS FROM SCRATCH",2,期,False,40,6,29,11,陳秀玲,"三3,4(醫IL 9010)","['', '', '34', '', '', '', '']","《講授類》
跨院通識與醫學院MED163課程併班上課",['全民國防微學程'],False
https://selcrs.nsysu.edu.tw/menu5/showoutline.asp?SYEAR=114&SEM=1&CrsDat=GEAI1978&Crsname=身心健康醫學講座,異動,更換教室8/29,False,跨院選修(醫),GEAI1978,0,不分班,"身心健康醫學講座
SPECIAL LECTURES ON PHYSICAL AND MENTAL HEALTH",2,期,False,90,31,90,0,"余靈珊,王文宏","一5,6(海ME 3006)","['56', '', '', '', '', '', '']","《講授類》
跨院通識與醫學院MED167課程併班上課",['校園預防醫學暨食品安全學程'],False
https://selcrs.nsysu.edu.tw/menu5/showoutline.asp?SYEAR=114&SEM=1&CrsDat=GEAI1979&Crsname=中醫暨整合醫學,異動,確認教師8/20,False,跨院選修(醫),GEAI1979,0,不分班,"中醫暨整合醫學
CHINESE AND INTEGRATIVE MEDICINE",2,期,False,30,2,30,0,"張嘉祐,許堯欽,謝孟倉,陳貞吟","四3,4(醫IL 9012)","['', '', '', '34', '', '', '']","《講授類》
跨院通識與醫學院MED168課程併班上課",[],False
https://selcrs.nsysu.edu.tw/menu5/showoutline.asp?SYEAR=114&SEM=1&CrsDat=GEAIE605&Crsname=通過體驗式學習自信地說英語（中級）,,,False,跨院EAP,GEAIE605,0,不分班,"通過體驗式學習自信地說英語（中級）
SPEAKING ENGLISH WITH CONFIDENCE THROUGH EXPERIENTIAL LEARNING(INTERMEDIATE LEVEL)",3,期,False,50,3,46,4,紀博善,"四2,3,4(社SS 2001)","['', '', '', '234', '', '', '']","《講授類》
限非外文系。建議英文程度『中級』以上程度學生修習選課。",['實用英語跨域學程'],True
https://selcrs.nsysu.edu.tw/menu5/showoutline.asp?SYEAR=114&SEM=1&CrsDat=GEAIE702&Crsname=英語簡報與口語表達（中高級）,,,False,跨院EAP,GEAIE702,0,不分班,"英語簡報與口語表達（中高級）
ENGLISH PRESENTATION AND ORAL EXPRESSION(HIGH-INTERMEDIATE LEVEL)",3,期,False,50,2,13,37,陳美淑,"三2,3,4(管CM 1019)","['', '', '234', '', '', '', '']","《講授類》
限非外文系。建議英文程度『中高級』以上程度學生修習選課。",['實用英語跨域學程'],True
https://selcrs.nsysu.edu.tw/menu5/showoutline.asp?SYEAR=114&SEM=1&CrsDat=GEAIE705&Crsname=科技英文閱讀（中高級）,異動,更換教室9/11,False,跨院EAP,GEAIE705,0,不分班,"科技英文閱讀（中高級）
ENGLISH READING FOR SCIENCE AND TECHNOLOGY（HIGH-INTERMEDIATE LEVEL）",3,期,False,50,0,31,19,陳美淑,"三5,6,7(社SS 3006)","['', '', '567', '', '', '', '']","《講授類》
限非外文系。建議英文程度『中高級』以上程度學生修習選課。",['實用英語跨域學程'],True
https://selcrs.nsysu.edu.tw/menu5/showoutline.asp?SYEAR=114&SEM=1&CrsDat=GEAIE706&Crsname=極限閱讀：挑戰想像力與創造力（中高級）,,,False,跨院EAP,GEAIE706,0,不分班,"極限閱讀：挑戰想像力與創造力（中高級）
EXTREME READING: CHALLENGES OF IMAGINATION AND CREATIVITY（HIGH-INTERMEDIATE LEVEL）",3,期,False,50,5,50,0,陳瑞華,"四2,3,4(通GE 3011)","['', '', '', '234', '', '', '']","《講授類》
限非外文系。建議英文程度『中高級』以上程度學生修習選課。",['實用英語跨域學程'],True
https://selcrs.nsysu.edu.tw/menu5/showoutline.asp?SYEAR=114&SEM=1&CrsDat=GEAIE802&Crsname=演說與辯論（高級）,異動,確認時間及教室6/23,False,跨院EAP,GEAIE802,0,不分班,"演說與辯論（高級）
PUBLIC SPEECH AND DEBATE（ADVANCED LEVEL）",3,期,False,35,2,31,4,林毓凱,"二2,3,4(文LA 1002)","['', '234', '', '', '', '', '']","《講授類》
限非外文系。建議英文程度『高級』以上程度學生修習選課。",['實用英語跨域學程'],True
https://selcrs.nsysu.edu.tw/menu5/showoutline.asp?SYEAR=114&SEM=1&CrsDat=GEAP202&Crsname=21 世紀影響力寫作技巧（中高級）,,,False,跨院EAP,GEAP202,0,不分班,"21 世紀影響力寫作技巧（中高級）
WRITING FOR IMPACT IN THE 21ST CENTURY (HIGH-INTERMEDIATE LEVEL)",3,期,False,35,1,6,29,戴藤懋,"四2,3,4(海ME 2005)","['', '', '', '234', '', '', '']","《講授類》
限非外文系。建議英文程度『中高級』以上程度學生修習選課。",[],True
https://selcrs.nsysu.edu.tw/menu5/showoutline.asp?SYEAR=114&SEM=1&CrsDat=GEAP204&Crsname=英文溝通技巧與批判性思維 （中高級）,,,False,跨院EAP,GEAP204,0,不分班,"英文溝通技巧與批判性思維 （中高級）
ENGLISH COMMUNICATION SKILLS AND CRITICAL THINKING (HIGH-INTERMEDIATE LEVEL)",3,期,False,50,2,20,30,曾千紋,"五2,3,4(管CM 2025)","['', '', '', '', '234', '', '']","《講授類》
限非外文系。建議英文程度『中高級』以上程度學生修習選課。",[],True
https://selcrs.nsysu.edu.tw/menu5/showoutline.asp?SYEAR=114&SEM=1&CrsDat=GESP298&Crsname=成功的英文寫作（中高級）,,,False,跨院EAP,GESP298,0,不分班,"成功的英文寫作（中高級）
WRITING FOR SUCCESS IN ENGLISH (HIGH-INTERMEDIATE LEVEL)",3,期,False,35,0,8,27,戴藤懋,"五2,3,4(海ME 2005)","['', '', '', '', '234', '', '']","《講授類》
限非外文系。建議英文程度『中高級』以上程度學生修習選課。",['全英語通識教育菁英學程'],True
https://selcrs.nsysu.edu.tw/menu5/showoutline.asp?SYEAR=114&SEM=1&CrsDat=GEAIE610&Crsname=賞析音樂學英語（中級）,,,False,跨院ESP,GEAIE610,0,不分班,"賞析音樂學英語（中級）
LEARNING ENGLISH THROUGH MUSIC APPRECIATION（INTERMEDIATE LEVEL）",3,期,False,50,9,54,-4,王品惠,"一2,3,4(通GE 4016)","['234', '', '', '', '', '', '']","《講授類》
限非外文系。建議英文程度『中級』以上程度學生修習選課。",['實用英語跨域學程'],True
https://selcrs.nsysu.edu.tw/menu5/showoutline.asp?SYEAR=114&SEM=1&CrsDat=GEAIE800&Crsname=科技英文（高級）,,,False,跨院ESP,GEAIE800,0,不分班,"科技英文（高級）
ENGLISH FOR SCIENCE AND TECHNOLOGY( ADVANCED LEVEL)",3,期,False,50,20,50,0,黃舒屏,"五2,3,4(通GE 3011)","['', '', '', '', '234', '', '']","《講授類》
限非外文系。建議英文程度『高級』以上程度學生修習選課。",['實用英語跨域學程'],True
